{
  "schema": "axiom-simulation/evaluation-record-v1",
  "evaluation_id": "robotics-production-sr1-001:run:evaluation",
  "evidence_ref": "robotics-production-sr1-001:run",
  "acceptance_contract": {
    "require_apex_success": true,
    "require_authorization_binding": true,
    "terminal_state_equals": {
      "scenario_id": "robotics-production-sr1-001",
      "unit_serial": "SR1-SYN-0001",
      "status": "RELEASED_SYNTHETIC",
      "requirements_revision": "A",
      "design_revision": "A",
      "material_lot": "LOT-SR1-001",
      "exceptions_resolved": [
        "lidar-delay",
        "wrong-controller-revision",
        "firmware-boot-failure",
        "motor-mount-torque"
      ],
      "verification": {
        "integrated_retest": "PASS",
        "quality": "ACCEPT"
      },
      "release": {
        "authority": "synthetic-release-board",
        "decision": "APPROVED",
        "physical_effects": "NONE"
      },
      "deployment": {
        "mode": "SIMULATED",
        "route": "simulated-indoor-route-01"
      },
      "feedback": {
        "issue": "camera-exposure",
        "disposition": "next-revision-B-candidate"
      }
    }
  },
  "checks": [
    {
      "id": "apex-success",
      "passed": true,
      "observed": 0
    },
    {
      "id": "authorization-binding",
      "passed": true,
      "observed": true
    },
    {
      "id": "terminal-state",
      "passed": true,
      "observed": {
        "deployment": {
          "mode": "SIMULATED",
          "route": "simulated-indoor-route-01"
        },
        "design_revision": "A",
        "exceptions_resolved": [
          "lidar-delay",
          "wrong-controller-revision",
          "firmware-boot-failure",
          "motor-mount-torque"
        ],
        "feedback": {
          "disposition": "next-revision-B-candidate",
          "issue": "camera-exposure"
        },
        "material_lot": "LOT-SR1-001",
        "release": {
          "authority": "synthetic-release-board",
          "decision": "APPROVED",
          "physical_effects": "NONE"
        },
        "requirements_revision": "A",
        "scenario_id": "robotics-production-sr1-001",
        "status": "RELEASED_SYNTHETIC",
        "unit_serial": "SR1-SYN-0001",
        "verification": {
          "integrated_retest": "PASS",
          "quality": "ACCEPT"
        }
      }
    },
    {
      "id": "evidence:effect-ledger",
      "passed": true,
      "observed": true
    },
    {
      "id": "evidence:authorization",
      "passed": true,
      "observed": true
    },
    {
      "id": "missing-authority-blocks-before-apex",
      "passed": true,
      "observed": {
        "exit_code": 1,
        "apex_response": null,
        "error": "authority_ref is required for authorized APEX dispatch"
      }
    },
    {
      "id": "live-recovery-reuses-completed-effects",
      "passed": true,
      "observed": {
        "exit_code": 0,
        "effect_files_unchanged": true,
        "observed_file_count": 16
      }
    }
  ],
  "result": "ACCEPT",
  "limitations": []
}
